comment_id,parent_youtube_comment_id,youtube_fan_id,content,archived,timestamp,video_title,total_comments,total_replies,responses,sec_comment,account_title,thumbnail_url
933818,,603424,I can wait to see you guys make it big much love,false,1609767486000,Grim - The Blue Stones (Guitar Lesson),1,0,0,,Adam Pflaum,https://yt3.ggpht.com/ytc/AAUvwnjFKWYfeyTDkLvK_TKIRnN2McwfTcwY9Qck2A=s48-c-k-c0xffffffff-no-rj-mo
5034,,3318,"Saludos desde chiapas. San crustibal de las casas, chiapas presentes!!!!",false,1543559535000,"The Blue Stones ""Black Holes (Solid Ground)"" [Official Lyric Video]",1,0,0,,Lulu Jimenez,https://yt3.ggpht.com/a/AATXAJySgOHFsUa0txGmK5N2S4a4rwdi71ADRTZlQwlcgQ=s48-c-k-c0xffffffff-no-rj-mo
5161,,3429,"I'm glad the Blue Stones are making a comeback
And this video actually corrects all the wrong lyrics to this song that are out there",false,1535059208000,"The Blue Stones ""Black Holes (Solid Ground)"" [Official Lyric Video]",1,0,0,,StreamL96,https://yt3.ggpht.com/a/AATXAJyTl-HVLe6XVbrcyUIy4aepZ6OWt5nA1U0OgAUe=s48-c-k-c0xffffffff-no-rj-mo
934236,4957,603587,"@Edorado Medici palaye royale, opeth (that band amazing), seven day sleep(underrated i guess),slaves,cleopatrick, the glorious sons, the offspring and moreee",false,1609218831000,"The Blue Stones ""Black Holes (Solid Ground)"" [Official Lyric Video]",3,2,0,1607270136000,Yunus Doğan,https://yt3.ggpht.com/ytc/AAUvwnhQt6h2feE49h1nlhy1TJLXd7Wwfl0mWdFM9vNl=s48-c-k-c0xffffffff-no-rj-mo
216452,,173492,Careless = priceless- did a little Motown drift over the river?- thats a bit of sweet soul music- I'm proud to have worked on this one lads,false,1602925881000,The Blue Stones - Live on Display,2,1,0,1602925528000,Mark Taaffe,https://yt3.ggpht.com/a/AATXAJyOMDXdxwArpL9tSneUELBLEsqueaSNvTPOxg=s48-c-k-c0xffffffff-no-rj-mo
215343,,173060,the intro gives me stylo vibes and i love it,false,1601677519000,"The Blue Stones ""Black Holes (Solid Ground)"" [Official Lyric Video]",1,0,0,,Ava noodle,https://yt3.ggpht.com/a/AATXAJyMLFSPUBfTa2x92rieb56QecTt6d1LcBWyfUWYoes=s48-c-k-c0xffffffff-no-rj-mo
4455,,2814,never clicked so fast,false,1570781049000,The Blue Stones - Shakin' Off The Rust [Official Lyric Video],1,0,0,,Antonio Jardon,https://yt3.ggpht.com/a/AATXAJzBALoQsHGcwTozhQhfJLOR3v7mYVBls8fwR4Qo=s48-c-k-c0xffffffff-no-rj-mo
4611,,2945,hi i was here yeah bye,false,1544524433000,"The Blue Stones ""Be My Fire"" [Audio]",1,0,0,,Carley Bailey,https://yt3.ggpht.com/a/AATXAJyWoCFXSzA3j77XtifvSeuNqbjQtc9LAKgH0hXZ=s48-c-k-c0xffffffff-no-rj-mo
3652,,2100,"Man this is what I’m talking about, literally on repeat since I first heard it. Ohhh and I can hear Paul Meany in the production and maybe synth works; that breakdown/outro was solid. Looking forward for the album",false,1577186565000,The Blue Stones - Grim (European Field Trip 2019),1,0,0,,SAITO,https://yt3.ggpht.com/a/AATXAJzUam6Cxu9M4_4XMcOfIvZETMsUhiE56789uzjY=s48-c-k-c0xffffffff-no-rj-mo
3919,,2339,The pepto,false,1574215183000,The Blue Stones - Shakin' Off the Rust [Official Music Video],1,0,0,,dracon raido,https://yt3.ggpht.com/a/AATXAJwLv5kxrtUhWMGjB25Uic9Eoif0t9WbCLQTiUm6=s48-c-k-c0xffffffff-no-rj-mo
3731,,2167,⚡🙌🏻 Rock out @ 2:27 (They gotta do this VR Concert now! would be cool!),true,1598842142000,The Blue Stones - Shakin' Off the Rust [Official Music Video],4,2,0,1602216696000,4everSongBird,https://yt3.ggpht.com/a/AATXAJwKc-x4r_gXY6RvfuelN5viZGtjB822C113pRX_Jw=s48-c-k-c0xffffffff-no-rj-mo
4902,,3200,ไม่นานเกิดแน่วงนี้ ผ่านๆๆ,false,1563050351000,"The Blue Stones ""Black Holes (Solid Ground)"" [Official Lyric Video]",1,0,0,,Jamille jamille,https://yt3.ggpht.com/a/AATXAJzk4_nWuWD-kxaeKccwbZO2QTWL_n5_U_1Pp2Gzkg=s48-c-k-c0xffffffff-no-rj-mo
216220,,173358,Love you Blue Stones. You guys rock.,false,1602849162000,"The Blue Stones ""Be My Fire"" [Audio]",4,1,0,1602849162000,Solomon Stello,https://yt3.ggpht.com/a/AATXAJwMtfnneG1h6Cu7tCXn5YUo8L0EwO0vqEqnJowRSQ=s48-c-k-c0xffffffff-no-rj-mo
12824,,8543,Where is the lyrics guy ?,false,1600033415000,The Blue Stones - Let It Ride (Official Video - Live on Display),1,0,0,,Harish Kumar,https://yt3.ggpht.com/a/AATXAJySaI7DmfziM5INGvi-y69hRHtJy28jt2ek6_3s=s48-c-k-c0xffffffff-no-rj-mo
628149,,2011,Grim making me crazy i set the volume 100 while im listening to it all my family know the song now 🤣,false,1606517119000,Grim and Careless (Piano Version),4,1,0,1606517029000,Emad Gholami,https://yt3.ggpht.com/a/AATXAJzFQe15Ix07IL2AEk-GfBHor_ZdlNanBNNvUA=s48-c-k-c0xffffffff-no-rj-mo
215192,,172984,"Took a minute to roam
Golden towers of you
No, I don't feel at home
This is something new
I think I'll stay for a while
Don't need me back so soon
'Cause I know you're holding it down
I've always counted on you
And I don't care 'bout the money
I know who I am
Now all my pockets are sunny
My faults are my friends
So let it ride till the morning, ride till the morning comes
Let it ride till the morning, ride till that morning comes
I think I loose track of time when post up at the bar
But you don't need to remind me what my vices are
I know it gets a little thick when I hop on the phone
Then I can always hear a timbre saying ""Come back home""
But if you love me like you say, you gotta let me roam till I'm ready
Till I'm ready
And I don't care 'bout the money
I know who I am
And all my pockets are sunny
My faults are my friends
So let it ride till the morning, ride till the morning comes
Let it ride till the morning, ride till that morning comes
I, I need It
I, I need to ride
I, I need It
I, I need to ride
I, I need It
If you love me like you say, you gotta let me roam
Girl, If you love me like you say, you gotta let me roam
Let me go!
So let it ride till the morning, ride till the morning comes
Let it ride till the morning, ride till that morning comes",false,1601449192000,The Blue Stones - Let It Ride (Official Video - Live on Display),2,0,0,1601449192000,Mu Tronic Online,https://yt3.ggpht.com/a/AATXAJy8Pkya-Iy2dGXsPGnILwrOxJiWyjRIlv2AjTnGiw=s48-c-k-c0xffffffff-no-rj-mo
3523,,1980,Love these lessons......love your music even more :D THANKS!,false,1597595718000,Grim - The Blue Stones (Guitar Lesson),1,0,0,,Rome,https://yt3.ggpht.com/a/AATXAJzwrrG0qjS099ibkeTdekcN2P7EbaMF_ifMcs0q=s48-c-k-c0xffffffff-no-rj-mo
4255,,2644,"*algorithm of youtube*
i love this song",false,1571453062000,The Blue Stones - Shakin' Off The Rust [Official Lyric Video],1,0,0,,iker,https://yt3.ggpht.com/a/AATXAJwpSnOmNWZvPdD22LE78Wh30LygtIjfN3vd4l0xIg=s48-c-k-c0xffffffff-no-rj-mo
4632,,2964,"Funny how some kids actually think "" they are here since the beginning "" 
That would be over 6 years ago.... 
Big cringy L 
But no matter what, this band is amazing",false,1541071762000,"The Blue Stones ""Be My Fire"" [Audio]",1,0,0,,Azure x-,https://yt3.ggpht.com/a/AATXAJxxEJ09I-Ax_fAgjm7olZBFaG25-Zs3CtCjPov2Ow=s48-c-k-c0xffffffff-no-rj-mo
3466,3454,,lmao its ok buddy we can't win em all,false,1595537724000,"Inspiration Behind ""Shakin' Off The Rust""",,,,,,
4028,,2437,Comment#600 catchy,false,1594025402000,The Blue Stones - Shakin' Off The Rust [Official Lyric Video],1,0,0,,kats korner,https://yt3.ggpht.com/a/AATXAJy1PsPT1xD1irVJaMZx516byHTAilD8j2KnSDj9=s48-c-k-c0xffffffff-no-rj-mo
934211,4906,603607,Could it be Nice To Luv You by 54-40?,false,1562894001000,"The Blue Stones ""Black Holes (Solid Ground)"" [Official Lyric Video]",,,,,raydarable,https://yt3.ggpht.com/ytc/AAUvwniDa_xeQMDbt2-PBdZd1ORT8OnEkupjtxOkVg=s48-c-k-c0xffffffff-no-rj-mo
3664,,2106,Damnnnnnn this shit goes hard 🔥🔥🔥,false,1576458244000,The Blue Stones - Grim (European Field Trip 2019),13,6,0,1603316026000,Corbettreportfan- Dmtwillsetyoufree,https://yt3.ggpht.com/a/AATXAJy9Vpew11jAoY_EmBKgGail17mCtW72F5gqv0J1=s48-c-k-c0xffffffff-no-rj-mo
3739,,2174,"Two requests:
1) Make Covid go away
2) Make mumble rap and mainstream pop go away. 
Blue Stones should at least be able to create a vaccine for one of these two requests.  :)",true,1593389857000,The Blue Stones - Shakin' Off the Rust [Official Music Video],2,0,1,1584183529000,jnorek,https://yt3.ggpht.com/a/AATXAJx36DBeXXcoTW8i-CdFhNsVbF_odFTkXsEOUg=s48-c-k-c0xffffffff-no-rj-mo
934107,4564,2904,All great bands! Don't forget royal blood and highly suspect,false,1554511343000,"The Blue Stones ""Be My Fire"" [Audio]",2,1,0,1554511186000,Taylor Perkins,https://yt3.ggpht.com/a/AATXAJxw_AsxenaS1eu-vgDM06kDUUt-cPgiOCR4pg=s48-c-k-c0xffffffff-no-rj-mo
132927,,107838,✨,false,1601312716000,The Blue Stones - Shakin' Off The Rust [Official Lyric Video],2,0,0,1601312716000,Jessica Adams,https://yt3.ggpht.com/a/AATXAJzQ41ixRXeYmzrAgOWMtRgke-EGuGa8w2EiAsz1Tw=s48-c-k-c0xffffffff-no-rj-mo
3508,,1969,"You guys doing a great job, keep rocking like that, great band. Saludos desde Chile",false,1591728870000,Be My Fire - Guitar Lesson + Performance,1,0,0,,Pablo Martínez Zúñiga,https://yt3.ggpht.com/a/AATXAJz5dp1x1nbmmXClwUteCAv3yFf5gLn4TXFiLcjM1vo=s48-c-k-c0xffffffff-no-rj-mo
4488,,2838,just realized its not a floating eyeball...,false,1579978383000,"The Blue Stones ""Be My Fire"" [Audio]",1,0,0,,keo kawasaki,https://yt3.ggpht.com/a/AATXAJwZ8gkGQkBu_FOsZztvEEmHK6RkR-LcdWEA2zYx=s48-c-k-c0xffffffff-no-rj-mo
13089,,8699,Such a great new band!!! They need to blow up!,false,1600446053000,The Blue Stones - Let It Ride (Official Video - Live on Display),1,0,0,,Paul Stich,https://yt3.ggpht.com/a/AATXAJzJmIxNs-KxwU84XouKnHnDcB0n2Vib3GNwog=s48-c-k-c0xffffffff-no-rj-mo
3760,,2195,"As a person who goes into VR Chat often the lack of computers, room sensors, hand controllers, and sensor suits bothers me. But still it's a good song.",false,1588280013000,The Blue Stones - Shakin' Off the Rust [Official Music Video],1,0,0,,zenopssmdk,https://yt3.ggpht.com/a/AATXAJy4XoE9FpQH2A2mgYFIbVkG87ri_0hFjiL6gj8N=s48-c-k-c0xffffffff-no-rj-mo
4828,,3136,The starting is like guardians of the galaxy 2,false,1576204035000,"The Blue Stones ""Black Holes (Solid Ground)"" [Official Lyric Video]",2,0,0,1576204035000,Dinosans 1,https://yt3.ggpht.com/a/AATXAJzcm8XArNkgf0l-N-MrxQhkNvCFiWIvpGbdZGNn6w=s48-c-k-c0xffffffff-no-rj-mo
3866,,2291,"Es Radio Doble Nueve
Lima, Perú XD",false,1574294946000,The Blue Stones - Shakin' Off the Rust [Official Music Video],2,0,0,1546548844000,RadioDonNowhere,https://yt3.ggpht.com/a/AATXAJz1pZUr3lj2JrHrD1UuEmmAKFQZmecBQRxsFdAZnw=s48-c-k-c0xffffffff-no-rj-mo
356348,,253171,OOOOOAAAHHH,false,1603313415000,The Blue Stones - Shakin' Off The Rust (Live on Display),1,0,0,,Julián S.,https://yt3.ggpht.com/a/AATXAJzdzZoCP229_d11QPbBuc0bd65uCjNf_SILXcxEnA=s48-c-k-c0xffffffff-no-rj-mo
933801,,603414,BEAST MODE ACTIVATED!,false,1608987839000,The Blue Stones - Grim (Live on Display),1,0,0,,Brenton Thornton,https://yt3.ggpht.com/ytc/AAUvwnj3yLfWg5Ccodp-p0tE9VokbEv2WDjgpxYOqeHQEA=s48-c-k-c0xffffffff-no-rj-mo
4749,,3066,amazing video !!!!!!!!!!,true,1594125514000,"The Blue Stones ""Black Holes (Solid Ground)"" [Official Lyric Video]",1,0,1,,theo berguig,https://yt3.ggpht.com/a/AATXAJy2MfdVV8LT_feRrMz1QQbSVJZ9agD_7wyLag=s48-c-k-c0xffffffff-no-rj-mo
4923,,3218,is to good if me o-o!!!!!!!!!!!!!!!,false,1559794854000,"The Blue Stones ""Black Holes (Solid Ground)"" [Official Lyric Video]",3,2,0,1559794882000,Natheaniel palmer,https://yt3.ggpht.com/a/AATXAJzdP1sgeGkT2Js7hPWKqBG4BJ-ae6TOOENccsZ_=s48-c-k-c0xffffffff-no-rj-mo
356321,,253154,I'm looking for a boyfriend 😍💋 💝💖 ♥ ️❤️,false,1603315328000,The Blue Stones - Careless (Live on Display),3,0,0,1603315359000,Tavondra Tyson,https://yt3.ggpht.com/a/AATXAJzkZ8PtqurmctlOav-v1z_DZSS5U86Ky0vGH-er=s48-c-k-c0xffffffff-no-rj-mo
4286,,2673,THE NEW FORD FOCUS!,false,1571358436000,The Blue Stones - Shakin' Off The Rust [Official Lyric Video],1,0,0,,Zelote,https://yt3.ggpht.com/a/AATXAJyDSiEmtaGvdhY4m4Njn660-sFb-r3tCyKxekGkWw=s48-c-k-c0xffffffff-no-rj-mo
934245,5000,3217,"Amun Ra torque ah but your Chevy twerks. 
Its my own fault.",false,1547717921000,"The Blue Stones ""Black Holes (Solid Ground)"" [Official Lyric Video]",15,11,0,1559841661000,Nathanial Stone,https://yt3.ggpht.com/a/AATXAJxiJwTvJ9WnhHvU7T_DrtKAf5ImHSjbZ35kvQ=s48-c-k-c0xffffffff-no-rj-mo
357273,,173292,"You could release a slow mellow version of album, it's as good Slow as it is fast,  it's actually quite therapeutic 🙂 Grim great song and the TV show was great to Grimm Big hi from UK 😁",false,1603637854000,Grim - The Blue Stones (Guitar Lesson),4,0,0,1603637854000,Miss Witty,https://yt3.ggpht.com/a/AATXAJyJP1Nx20F7A_AvHqttaGVwSxbtV1vNF630mQ=s48-c-k-c0xffffffff-no-rj-mo
3832,,2261,Rebel 101.7 OTTAWA'S REAL ROCK. SUCK IT CHEZ! DON'T WANT YOUR BOOMER ROCK.,false,1575424035000,The Blue Stones - Shakin' Off the Rust [Official Music Video],2,0,0,1551398984000,Brandan Briscoe,https://yt3.ggpht.com/a/AATXAJx7v5xCJ8eW7_WuJ50rfEafheURTMB8wYMXKrEM3w=s48-c-k-c0xffffffff-no-rj-mo
4402,,2772,This is SICK... LOVE  the Video too.,false,1570837598000,The Blue Stones - Shakin' Off The Rust [Official Lyric Video],1,0,0,,Palmsun,https://yt3.ggpht.com/a/AATXAJzUnFJpbEYnoTpR5MnvZ5c7QP_oJjqQmQcVYoiH=s48-c-k-c0xffffffff-no-rj-mo
934027,4284,603514,chemicapsule I would say 'indie rock'. Check out The score or maybe Nothing but Thieves for more stuff like this! Especially The Score,false,1571571918000,The Blue Stones - Shakin' Off The Rust [Official Lyric Video],,,,,Kimaru Sei,https://yt3.ggpht.com/ytc/AAUvwngmhmIwMplSRD5uXXq7-O3nlVYFAZD0eppft4hw=s48-c-k-c0xffffffff-no-rj-mo
934067,4379,603535,How about Justin’s back up vocals ?,false,1570917603000,The Blue Stones - Shakin' Off The Rust [Official Lyric Video],,,,,Jonathan Tessier,https://yt3.ggpht.com/ytc/AAUvwnhir9YMWglAGU6xB8m4hcnzJD0hzd4XwSDZM1dL=s48-c-k-c0xffffffff-no-rj-mo
3796,,2226,I been listening to this guy's probably for a yr now and never knew it was just 2 guys.,false,1584080743000,The Blue Stones - Shakin' Off the Rust [Official Music Video],1,0,0,,Victor Huerta,https://yt3.ggpht.com/a/AATXAJwIacDWFAm49sFn1qR0KRnpadxE3Oj1ZZUW0f8O_AY=s48-c-k-c0xffffffff-no-rj-mo
4643,,2973,😍,false,1539398148000,"The Blue Stones ""Be My Fire"" [Audio]",1,0,0,,holassdf,https://yt3.ggpht.com/a/AATXAJwLat45SKbh4W2l3Ik6-cuQ_4qszFeFWlVS1R9H=s48-c-k-c0xffffffff-no-rj-mo
934121,4667,603559,Herooo,false,1545749700000,"The Blue Stones ""Be My Fire"" [Audio]",,,,,Mguel Pérez,https://yt3.ggpht.com/ytc/AAUvwnjlAf5ahftuA6dc8dBWR0ZRHkHc9oAxHy4i8mQeIQ=s48-c-k-c0xffffffff-no-rj-mo
3485,,1951,"It's been awesome watching you evolve more, as a pianist. Thanks for sharing your journey, and for boosting moral worldwide 😎",false,1588327106000,Late night piano jam,1,0,0,,Shayla Jade,https://yt3.ggpht.com/a/AATXAJzZAe_4sIw2Y9bFd68CxRhddO0D3FZRqPxVsncy=s48-c-k-c0xffffffff-no-rj-mo
4644,,2974,they are gonna blow up very soon,false,1539334721000,"The Blue Stones ""Be My Fire"" [Audio]",1,0,0,,daniel garcia soni,https://yt3.ggpht.com/a/AATXAJzvY9FFiDnxm3SJ3zzIkyUlhadXIOJ1AuoQ1sEhzg=s48-c-k-c0xffffffff-no-rj-mo
4526,,2872,"I put the Black Keys' new album on shuffle in the backseat of a long car ride and dozed off for a while, and woke up to this song playing.  Glad I found these guys!",false,1564335521000,"The Blue Stones ""Be My Fire"" [Audio]",1,0,0,,Oblong Grape,https://yt3.ggpht.com/a/AATXAJxZN2uaNOXhFK7uYqrfl1G5qtoaGoVJnU2wwC-FKg=s48-c-k-c0xffffffff-no-rj-mo
6702,,4119,NFL starts and a new single in the same day?! Best day in a while!!,true,1599764865000,The Blue Stones - Let It Ride (Official Video - Live on Display),2,1,1,1599764865000,Jim Bob,https://yt3.ggpht.com/a/AATXAJwtsB2HyiLbvYxYm7W8t4orrHvKytRzrib6KhuG=s48-c-k-c0xffffffff-no-rj-mo
6824,,2302,YEAH!!!! Great stuff and the Blue Stones Style I love so much!,false,1599822981000,The Blue Stones - Let It Ride (Official Video - Live on Display),2,0,0,1574254465000,Claudia Appel,https://yt3.ggpht.com/a/AATXAJyU2M3AtBdcqhgS7ITGMOr-s4hG0oWZUFPQaneFiw=s48-c-k-c0xffffffff-no-rj-mo
3635,,2083,"Jan 23rd kingston Ont, best bday present ive got myself in a long time",false,1580968466000,The Blue Stones - Grim (European Field Trip 2019),2,0,0,1579298967000,Bryan Marshall,https://yt3.ggpht.com/a/AATXAJzgBSlA3VAvq2KXLsMMuL9FcXm7bWngHp-1AA=s48-c-k-c0xffffffff-no-rj-mo
3964,,2377,"Congrats you took a deep thoughtful song and slapped it on an Apple commercial full of cookie cutter hipsters...shoot the director and just leave the lyric vid up.

Awesome bloody song.",false,1574206054000,The Blue Stones - Shakin' Off the Rust [Official Music Video],2,1,0,1574206054000,Easy There,https://yt3.ggpht.com/a/AATXAJyg5_-WnyxpPRiODAam4q04izmcj80K4nULUkJyKw=s48-c-k-c0xffffffff-no-rj-mo
4661,,2990,"Discovered these guys yesterday, actually loving them.",false,1537860037000,"The Blue Stones ""Be My Fire"" [Audio]",1,0,0,,Sarath Raj,https://yt3.ggpht.com/a/AATXAJy3PTHG08eSR0fq8BFYBll3AGP4qklkq7DaQiEE=s48-c-k-c0xffffffff-no-rj-mo
4674,,3002,Cuando sean famosos no se olviden de nosotros :'v,false,1537033522000,"The Blue Stones ""Be My Fire"" [Audio]",2,0,0,1536999376000,worldxskies,https://yt3.ggpht.com/a/AATXAJxD4e3P_EkDvnCjw9Y5LuZGoUh1WqduD14tuQ=s48-c-k-c0xffffffff-no-rj-mo
357340,,2819,I was with some woman last week. She asked me how old I was and.... I had to think about it. I'm 35 the math should have been easy but goddammit I love Blue Stones 😉,false,1603686854000,The Blue Stones - Grim (European Field Trip 2019),2,0,0,1596850230000,William Gene,https://yt3.ggpht.com/a/AATXAJzRkTx-2Yck11p6H4KhKiDliDHQOGt2Ha05cNLG=s48-c-k-c0xffffffff-no-rj-mo
5111,,3389,I only can say Wow! :0,false,1538124571000,"The Blue Stones ""Black Holes (Solid Ground)"" [Official Lyric Video]",1,0,0,,SRM,https://yt3.ggpht.com/a/AATXAJxmq_KAfZrmPWpbuU-7uJm4z4odcK1_sisavG7oMQ=s48-c-k-c0xffffffff-no-rj-mo
934200,4856,603601,Nope,false,1569922857000,"The Blue Stones ""Black Holes (Solid Ground)"" [Official Lyric Video]",,,,,Slippy Napkins,https://yt3.ggpht.com/ytc/AAUvwnhZjqeaT9MeBAWnlgAKGaymmeAYmA6TgT9owS-xRA=s48-c-k-c0xffffffff-no-rj-mo
12739,,2019,Hi! Do you use any distortion/overdrive effects on the vocals for live sessions?,false,1599907447000,The Blue Stones - Let It Ride (Official Video - Live on Display),3,0,0,1586683389000,qu4zz4r,https://yt3.ggpht.com/a/AATXAJwVZrk2Hx2koHZPEgA-VoOHLL6c17A39Az_Ug=s48-c-k-c0xffffffff-no-rj-mo
933950,3951,603471,Eli Bro so i send 20$ i’ll get 100$?,false,1574207068000,The Blue Stones - Shakin' Off the Rust [Official Music Video],,,,,Titan Dreamer,https://yt3.ggpht.com/ytc/AAUvwnim1l_JDQVBO3lvxo3lg8EZU1lFPO_BIoCMz0fW=s48-c-k-c0xffffffff-no-rj-mo
4426,,2790,needed a good song,false,1570791095000,The Blue Stones - Shakin' Off The Rust [Official Lyric Video],1,0,0,,Dopatonin,https://yt3.ggpht.com/a/AATXAJxHjEsJdXZnzwNKDGGIPkuJ3xnQq8BeAL7_0Ik7FA=s48-c-k-c0xffffffff-no-rj-mo
4761,,3078,как для йогурта  нормально .,false,1591064859000,"The Blue Stones ""Black Holes (Solid Ground)"" [Official Lyric Video]",1,0,0,,Станислав Мал,https://yt3.ggpht.com/a/AATXAJzV6Ml2A62rLN2w9p-V3RgonCAKC0p8MeTzimQhPA=s48-c-k-c0xffffffff-no-rj-mo
4034,,2442,I feel like this would be a song they bought and put in the sound track to a WWE 2K game,false,1592675595000,The Blue Stones - Shakin' Off The Rust [Official Lyric Video],1,0,0,,Paradox In Yo Socks,https://yt3.ggpht.com/a/AATXAJyqsOqiV8BWdC8SLtojwQ_xi4yaTCbknxzHW1zI7Q=s48-c-k-c0xffffffff-no-rj-mo
3554,,2009,"One of the their best songs if not the best, different yes but for anyone who drives the nights alot this song is just it. Smooth and very chill, stop hating and just appreciate good music",true,1589416953000,Careless [Visualizer Lyric Video],1,0,1,,Mnov Straits,https://yt3.ggpht.com/a/AATXAJy8rV93MuF_ClDZgSGLI7thyJ6oOll5RAD1zhMgldY=s48-c-k-c0xffffffff-no-rj-mo
934021,4256,603491,You'd call this Indie? Idk... Maybe a modern type of Rock.,false,1589012943000,The Blue Stones - Shakin' Off The Rust [Official Lyric Video],,,,,Iggy Stardust,https://yt3.ggpht.com/ytc/AAUvwnjYGFJy9G07UcsY2A6yEAn7i_-CSqU1100nGA=s48-c-k-c0xffffffff-no-rj-mo
3465,3454,1939,* hello darkness my old friend * 😅,false,1595977702000,"Inspiration Behind ""Shakin' Off The Rust""",,,,,Emilie A,https://yt3.ggpht.com/a/AATXAJyC0XWAMtIWDTsCBT0sizSv4s7YzfnSsRU6rQ=s48-c-k-c0xffffffff-no-rj-mo
4229,,2621,Instant FIFA 21 soundtrack nominee.,false,1571748155000,The Blue Stones - Shakin' Off The Rust [Official Lyric Video],1,0,0,,Ori Mager,https://yt3.ggpht.com/a/AATXAJwKZWOsGNYw9-79VmFKoF8WIseWCtSX3KGg2g=s48-c-k-c0xffffffff-no-rj-mo
3682,,2127,Good Stuff,false,1576294259000,The Blue Stones - Grim (European Field Trip 2019),3,0,0,1571542148000,bthyname1,https://yt3.ggpht.com/a/AATXAJy1HqJrolKguWEOhtuw5wdJ7X-DiipHyRpU9A=s48-c-k-c0xffffffff-no-rj-mo
3634,,2008,Albany show was just toooooo goooood!,false,1582013430000,The Blue Stones - Grim (European Field Trip 2019),4,0,0,1589764136000,Marie DB,https://yt3.ggpht.com/a/AATXAJxNmBMvJ_Kej8Mq6fvXbG62BEo3Dv--v-9iLWErdEM=s48-c-k-c0xffffffff-no-rj-mo
5077,,3357,"I found them out months ago and now their album is going to be realised in two fucking days
I'M SO HAPPY",false,1540428687000,"The Blue Stones ""Black Holes (Solid Ground)"" [Official Lyric Video]",1,0,0,,Sofia Libri,https://yt3.ggpht.com/a/AATXAJyfGYRngwjc3i5uAssWIpfK3MHDahA_2QpHoIy-Dw=s48-c-k-c0xffffffff-no-rj-mo
357554,6734,253612,Make multiple accounts,false,1603826246000,The Blue Stones - Let It Ride (Official Video - Live on Display),2,1,0,1603615492000,Awesome juni,https://yt3.ggpht.com/a/AATXAJwevyC7orSxMI1pu_OeIbtt2mxk9H6qUC1xY7RB=s48-c-k-c0xffffffff-no-rj-mo
934000,4149,603491,Hahaha,false,1589013081000,The Blue Stones - Shakin' Off The Rust [Official Lyric Video],,,,,Iggy Stardust,https://yt3.ggpht.com/ytc/AAUvwnjYGFJy9G07UcsY2A6yEAn7i_-CSqU1100nGA=s48-c-k-c0xffffffff-no-rj-mo
3838,,2266,black mirror's vibes,false,1574485854000,The Blue Stones - Shakin' Off the Rust [Official Music Video],1,0,0,,Gustavo Faria,https://yt3.ggpht.com/a/AATXAJwB5mHTmHmyv_KfIBhOTYo1lm-YOAY1r7zaD6cbAaA=s48-c-k-c0xffffffff-no-rj-mo
362892,,255804,"Unreal, fantastic!!! I love this band!!❤️❤️😍🇺🇦🇺🇦",false,1604070298000,The Blue Stones - Grim (Live on Display),1,0,0,,Rock-Banana,https://yt3.ggpht.com/a/AATXAJyILJSt59kdcXsoRp0AP58Zw-utJ_mb0cLtlfBM0A=s48-c-k-c0xffffffff-no-rj-mo
3440,,1919,Me!! Come see me!!!!,false,1596155711000,Who Would You See in a VR Concert?,2,0,0,1595372606000,MrWadrO Rodriquez,https://yt3.ggpht.com/a/AATXAJzz0oPEMaABhQjeRagfhh_Ji-YdpRswhugZsWHX=s48-c-k-c0xffffffff-no-rj-mo
6805,6734,4182,"Well, you could share it and then like it😁",false,1599790754000,The Blue Stones - Let It Ride (Official Video - Live on Display),,,,,misterh55,https://yt3.ggpht.com/a/AATXAJyQpXJSuY0DtHD6Nk9t3sw9ZyTRjD3eBRYtUg=s48-c-k-c0xffffffff-no-rj-mo
215807,,173230,"why have i not heard this before, what a song !",false,1602116048000,The Blue Stones - Shakin' Off The Rust [Official Lyric Video],1,0,0,,Ayden Van Buuren,https://yt3.ggpht.com/a/AATXAJzA8NKsS_5MaVAMJmM0C8XOX1YnKSMTPDOyMKwYQw=s48-c-k-c0xffffffff-no-rj-mo
13044,,8675,"Your music is a big part of what's kept me going the past three years. You guys are amazing, thank you.",false,1600307476000,The Blue Stones - Let It Ride (Official Video - Live on Display),1,0,0,,Olivia Mueller,https://yt3.ggpht.com/a/AATXAJx9jA15oFg-SQyTPYgeiwbrnhGjFufMn66ziQ=s48-c-k-c0xffffffff-no-rj-mo
3606,,2059,that guitar tone in the chorus 👌🏻❤️ amazing song as always 🥰🥰,false,1585937832000,Careless [Visualizer Lyric Video],3,2,0,1586452849000,Luka Buncic,https://yt3.ggpht.com/a/AATXAJzX7YXuUVp2dROeS-VVX_oQg6-76ACWIrL9WlGu=s48-c-k-c0xffffffff-no-rj-mo
6795,,4175,Uuuuuuhhh yeahhh!!! Pure talent....,false,1599779489000,The Blue Stones - Let It Ride (Official Video - Live on Display),1,0,0,,Slc 2,https://yt3.ggpht.com/a/AATXAJw8fLt5qo-X7mAwAmmRp-C8aKBWoJhRnFMlDQ=s48-c-k-c0xffffffff-no-rj-mo
215365,,173069,"821 Cardi B fans thumbed this song down. These guys have more talent in one finger than every ""performer"" currently in the Top 40 put together.",false,1601686035000,The Blue Stones - Shakin' Off The Rust [Official Lyric Video],1,0,0,,Fred Moore,https://yt3.ggpht.com/a/AATXAJwn19Wn20wLyKCWnr-5Cjg42D-tT1uA3Z-CCg=s48-c-k-c0xffffffff-no-rj-mo
13061,,8687,Can't wait to see you guys live again!,false,1600388734000,The Blue Stones - Let It Ride (Official Video - Live on Display),1,0,0,,dhazard,https://yt3.ggpht.com/a/AATXAJxV7la5VXd2cVNI2CMpjArNcmeAB-xLnUN7TWI=s48-c-k-c0xffffffff-no-rj-mo
3628,,2078,Essa música é muito boa!,false,1588209936000,The Blue Stones - Grim (European Field Trip 2019),1,0,0,,Gleyson Araujo,https://yt3.ggpht.com/a/AATXAJwHtGZY6AlxOSjk5NNkhe43pC8MG1AoCQb17_-F=s48-c-k-c0xffffffff-no-rj-mo
4518,,2865,liked the beat,false,1568386127000,"The Blue Stones ""Be My Fire"" [Audio]",1,0,0,,Turin,https://yt3.ggpht.com/a/AATXAJwcNcZlMpejsYZekMnVysy_r7q9fcgEuN-Msw=s48-c-k-c0xffffffff-no-rj-mo
3656,,2104,your'e song is awesome  😳👍🏆👑😁😎🎼,false,1576916024000,The Blue Stones - Grim (European Field Trip 2019),5,0,0,1600051530000,ERIC KARL,https://yt3.ggpht.com/a/AATXAJyNcDQJV6xLG7Tc3u3fCTINIKIIxXShzDTq88uT=s48-c-k-c0xffffffff-no-rj-mo
6777,,2030,"THIS IS 🔥🔥🔥🔥🔥🔥
Love you guys so much! Never disappointed!",false,1599785818000,The Blue Stones - Let It Ride (Official Video - Live on Display),4,0,1,1599785818000,Naomi,https://yt3.ggpht.com/a/AATXAJxHswZPTVuLZKtDX0B5k8KnQbN8-mS2iInNt3oDAA=s48-c-k-c0xffffffff-no-rj-mo
6698,,1908,Excited I can block out the ugly for a while!!! Thank you!!!,true,1599711946000,The Blue Stones - Let It Ride (Official Video - Live on Display),2,0,1,1598593245000,Kelly Langhals,https://yt3.ggpht.com/a/AATXAJznCSQ7l2_kviYWgsUnX9xn5iT2JyPllfWWJA=s48-c-k-c0xffffffff-no-rj-mo
