comment_id,parent_youtube_comment_id,youtube_fan_id,content,archived,timestamp,video_title,total_comments,total_replies,responses,sec_comment,account_title,thumbnail_url
4733,,2049,"Can't wait for the LP, you guys really do rock! Wish you guys the best of luck on your music career and please, keep up with the awesome tracks.",false,1534495682000,"The Blue Stones ""Be My Fire"" [Audio]",3,1,0,1534526334000,Cirr0sLITE,https://yt3.ggpht.com/a/AATXAJxrwpGJQ7YH_ErsX-PyBldrbpZj9cv7mSULkOMgJg=s48-c-k-c0xffffffff-no-rj-mo
4329,,2715,Another amazing song from my Canadian brothers,false,1571123235000,The Blue Stones - Shakin' Off The Rust [Official Lyric Video],1,0,0,,Blake Bester,https://yt3.ggpht.com/a/AATXAJyJtX3NG9y1zVCB1Fud37bUoacZ8QxTohnbNA=s48-c-k-c0xffffffff-no-rj-mo
5190,,3454,This has way more beef than the original. Was this remastered?,false,1532045308000,"The Blue Stones ""Black Holes (Solid Ground)"" [Official Lyric Video]",1,0,0,,Beranin,https://yt3.ggpht.com/a/AATXAJyF6rMjVmHfeSo81Wh-zW499QWrXPb84qAPVaQ=s48-c-k-c0xffffffff-no-rj-mo
4114,,2516,I am the blue stones and the sound of silence is killing me,false,1582864438000,The Blue Stones - Shakin' Off The Rust [Official Lyric Video],1,0,0,,Brandon Bailey,https://yt3.ggpht.com/a/AATXAJwt0g9MCgfNuo_ibSuEFVg0vuxRvv87knBh=s48-c-k-c0xffffffff-no-rj-mo
4973,,3263,I love this holy guamole on cheese---------,false,1551039815000,"The Blue Stones ""Black Holes (Solid Ground)"" [Official Lyric Video]",1,0,0,,Sweet Tooth,https://yt3.ggpht.com/a/AATXAJzjULZgeuz2m5_vZ9vkYJfSVHKqYIytmk6VaXSH=s48-c-k-c0xffffffff-no-rj-mo
216090,,173291,when you ejected in among us be like :,false,1602642382000,"The Blue Stones ""Black Holes (Solid Ground)"" [Official Lyric Video]",1,0,0,,S A D,https://yt3.ggpht.com/a/AATXAJye9kfLdklPLb-par_a1xGcsuse15WcyNpylJK7SA=s48-c-k-c0xffffffff-no-rj-mo
4422,,2787,Some tone,false,1570796719000,The Blue Stones - Shakin' Off The Rust [Official Lyric Video],5,3,0,1548997164000,hilly scotsman,https://yt3.ggpht.com/a/AATXAJwZiraBuxciccMZZvxx7hzOKkD9Rckpcl9-Ow=s48-c-k-c0xffffffff-no-rj-mo
4202,,2597,🇧🇷,false,1573245778000,The Blue Stones - Shakin' Off The Rust [Official Lyric Video],1,0,0,,Mariana Barbosa,https://yt3.ggpht.com/a/AATXAJxyF9mAVfDb-v2AlWsBRURqm-vqx56ccct0o8Yz0w=s48-c-k-c0xffffffff-no-rj-mo
5063,,3345,wowwww Omg,false,1541212248000,"The Blue Stones ""Black Holes (Solid Ground)"" [Official Lyric Video]",1,0,0,,smidra lower,https://yt3.ggpht.com/a/AATXAJzjFdMA7I48pJaqlZc7G7SWltHvAu2USAxdZQ=s48-c-k-c0xffffffff-no-rj-mo
4389,,2263,"Lo volvieron hacer !!! Buenísima canción !!! 


Cuando vienen a México !!!",false,1570862211000,The Blue Stones - Shakin' Off The Rust [Official Lyric Video],3,0,0,1570862211000,Antonio Cruz,https://yt3.ggpht.com/a/AATXAJwfr2vqveXrLYHDG53i3kdecGPG0kJlnArWqQ=s48-c-k-c0xffffffff-no-rj-mo
4241,,2633,"God, I love Rock and Roll more than ever :)",false,1571621057000,The Blue Stones - Shakin' Off The Rust [Official Lyric Video],2,0,0,1535497989000,Imre Bristyán,https://yt3.ggpht.com/a/AATXAJwaA_kvTv5wZZ-ENcu3Cugen5QG_awGukXXZMF1=s48-c-k-c0xffffffff-no-rj-mo
21053,,2479,"""FUNKY""",false,1600235493000,The Blue Stones - Shakin' Off The Rust [Official Lyric Video],2,0,0,1587372014000,StreetGlide14,https://yt3.ggpht.com/a/AATXAJzP9MRpUkLCzJQlIaA8h4_Hzt1e0ukS_mgwJH5Mpw=s48-c-k-c0xffffffff-no-rj-mo
3659,,2106,Am I awake?,false,1576644216000,The Blue Stones - Grim (European Field Trip 2019),13,6,0,1603316026000,Corbettreportfan- Dmtwillsetyoufree,https://yt3.ggpht.com/a/AATXAJy9Vpew11jAoY_EmBKgGail17mCtW72F5gqv0J1=s48-c-k-c0xffffffff-no-rj-mo
3915,,2335,"So, when we gonna see you all in Florida?",false,1574216335000,The Blue Stones - Shakin' Off the Rust [Official Music Video],2,0,0,1535935428000,Aratherdrunkmedic,https://yt3.ggpht.com/a/AATXAJzmeLX4tpucmKN_L0vMoZpGfuoRksifnq8t9H5e=s48-c-k-c0xffffffff-no-rj-mo
216192,,173345,what turd gave this a thumbs down?,false,1602816740000,The Blue Stones - Live on Display,1,0,0,,Scott Dreyer,https://yt3.ggpht.com/a/AATXAJy4vFWEcF2ytddF4HEqGPY9D_BhXtgKmi8mXA=s48-c-k-c0xffffffff-no-rj-mo
4570,,2911,Nice <3,false,1553237973000,"The Blue Stones ""Be My Fire"" [Audio]",2,0,0,1553237973000,NESSTOR94,https://yt3.ggpht.com/a/AATXAJyCYsuPNlKwCqLa2-iDT9oCKmC6uqx5yzKl8yX8AQ=s48-c-k-c0xffffffff-no-rj-mo
4346,,2732,Yeeeeeesss. You do this!!😍😍,false,1571016589000,The Blue Stones - Shakin' Off The Rust [Official Lyric Video],1,0,0,,I'm a Muser,https://yt3.ggpht.com/a/AATXAJwglT4bIf3tOGXV7UTKgwLAj_m7hKKKghALTSbT_w=s48-c-k-c0xffffffff-no-rj-mo
4840,,3146,Good,false,1573892587000,"The Blue Stones ""Black Holes (Solid Ground)"" [Official Lyric Video]",1,0,0,,i see you are a man of culture as well,https://yt3.ggpht.com/a/AATXAJxPD2Zk8MHHbtFSiK42S-ddQXOZEsYTPMGcmqE6YQ=s48-c-k-c0xffffffff-no-rj-mo
3530,,1987,Gracias!! Tu música me encanta ..soy de argentina no puede ver el vivo pero acá estoy apoyando a un artista gracias por compartir,false,1586677433000,Grim - The Blue Stones (Guitar Lesson),2,0,0,1586047944000,diego Cabrera,https://yt3.ggpht.com/a/AATXAJxDxJEOhenn6nWrBoOGVpEgfnNY-t98P_JaNICc=s48-c-k-c0xffffffff-no-rj-mo
934065,4379,2513,Agreeeddd,false,1583051527000,The Blue Stones - Shakin' Off The Rust [Official Lyric Video],2,1,0,1583051472000,Jillian Elise,https://yt3.ggpht.com/a/AATXAJyVgN5spR5jCLjC9h8CmRWB0h9mbjgu5BexCWBsQw=s48-c-k-c0xffffffff-no-rj-mo
357262,356652,253608,"Here from EU too, amazing band, many beautiful effects with the voice! Both very creative!",false,1603577656000,The Blue Stones - Careless (Live on Display),,,,,Michi N,https://yt3.ggpht.com/a/AATXAJzIEN74ti7NYfD23ICjH0_ZpLxPwJn8EZbS4Q=s48-c-k-c0xffffffff-no-rj-mo
3538,,1994,"Not bad but I think I like your other songs more, but thats just me",true,1598798404000,Careless [Visualizer Lyric Video],1,0,0,,Lardex,https://yt3.ggpht.com/a/AATXAJwT-SXcFCXSmrtP0h7957BKVx_RuLhE2guVg6kv=s48-c-k-c0xffffffff-no-rj-mo
933985,4027,,🙏,false,1594240224000,The Blue Stones - Shakin' Off The Rust [Official Lyric Video],,,,,,
4746,,2821,Always has been,false,1594905843000,"The Blue Stones ""Black Holes (Solid Ground)"" [Official Lyric Video]",2,0,0,1594905843000,iGhost,https://yt3.ggpht.com/a/AATXAJxStHJqY7LCgAaH5e4vhx0rbyDKDi2wfZyfBAWabw=s48-c-k-c0xffffffff-no-rj-mo
934227,4933,603612,Little did they know that this was a lyric video......,false,1587465466000,"The Blue Stones ""Black Holes (Solid Ground)"" [Official Lyric Video]",,,,,jjE,https://yt3.ggpht.com/ytc/AAUvwnjmH9vJjBswO0LPiTH6JoZ42RaeFaWopynTGXsCIA=s48-c-k-c0xffffffff-no-rj-mo
934216,4910,603610,Con esta canción estoy terminando mi 2019. Afortunados ambos,false,1577405581000,"The Blue Stones ""Black Holes (Solid Ground)"" [Official Lyric Video]",,,,,FM,https://yt3.ggpht.com/ytc/AAUvwnjc6XSesKGNljbOnWnyokZDqE_f1Xvvxm3XYatLjA=s48-c-k-c0xffffffff-no-rj-mo
4175,,2211,What's a fork in the road? When you decide something is to dirty for you. That was Adam and why my car got burnt. He was to careless and sloppy and dirty.,false,1575488442000,The Blue Stones - Shakin' Off The Rust [Official Lyric Video],15,0,0,1590126486000,kelly stone,https://yt3.ggpht.com/a/AATXAJzJHdrWUaEPTPEAfriKtJfVwQxzXFaK4n45tTfX_Q=s48-c-k-c0xffffffff-no-rj-mo
5152,,3424,When this song reaches 20 million views - I was here first!,false,1536099290000,"The Blue Stones ""Black Holes (Solid Ground)"" [Official Lyric Video]",1,0,0,,Layonix,https://yt3.ggpht.com/a/AATXAJyrj9328DF4D8CgzACjWeptS4TpgqnOmya6J022=s48-c-k-c0xffffffff-no-rj-mo
5038,,2963,This song right here? This song here?,false,1543232009000,"The Blue Stones ""Black Holes (Solid Ground)"" [Official Lyric Video]",2,0,0,1541084765000,Pumpkineck Bort,https://yt3.ggpht.com/a/AATXAJzWAQ91kvq36TESiUNK_1sk_NjBnXMxx_aEUiIY7w=s48-c-k-c0xffffffff-no-rj-mo
6725,,2071,This is 💯 worth the wait. 🤘🏼,false,1599776418000,The Blue Stones - Let It Ride (Official Video - Live on Display),2,0,0,1585706793000,DeeV8night,https://yt3.ggpht.com/a/AATXAJwJPdpZDZBBXeqiCfo5nxW1L8b_MV5tSJ234x537A=s48-c-k-c0xffffffff-no-rj-mo
3787,,2220,GET  IT UP YA .OM,false,1585173759000,The Blue Stones - Shakin' Off the Rust [Official Music Video],2,0,0,1585173759000,MrTeapotpilot,https://yt3.ggpht.com/a/AATXAJwaNlzudcE_0X37LbvM7haP2H1718SVt3Ce30dc=s48-c-k-c0xffffffff-no-rj-mo
6902,6702,4228,Faakin crazy mate givvin some attention To my detention,false,1599837266000,The Blue Stones - Let It Ride (Official Video - Live on Display),,,,,Adam Vorster,https://yt3.ggpht.com/a/AATXAJwxBNFCeFOHTDisFazDNP51R0YLA8I262Xysw=s48-c-k-c0xffffffff-no-rj-mo
216184,,173255,🇲🇽🔥🇲🇽,false,1602823110000,The Blue Stones - Live on Display,4,0,0,1602823110000,FoxWolf666,https://yt3.ggpht.com/a/AATXAJziDIpCgP_8luG9kPW4z-r_sPuVH3w1ZXmKQDuliQ=s48-c-k-c0xffffffff-no-rj-mo
934131,4694,2145,"Hell yeah! The drop was one of my favourites, I also want to hear the hard part and midnight remastered cos they were great too. The whole album is just fantastic",false,1536289424000,"The Blue Stones ""Be My Fire"" [Audio]",12,8,0,1602813194000,Mr Flibble,https://yt3.ggpht.com/a/AATXAJz3OHlrZi8A6tBepOrhtkoOuTlZgDYoOyieYqthRw=s48-c-k-c0xffffffff-no-rj-mo
216212,,4166,2020 just got a little better,true,1602840807000,The Blue Stones - Live on Display,2,0,1,1599780987000,Frank,https://yt3.ggpht.com/a/AATXAJy4dLkPbs8lS5pbba2yF8c5_3r26iTlmeSUgthu=s48-c-k-c0xffffffff-no-rj-mo
4913,,3209,This is awsome...,false,1560548854000,"The Blue Stones ""Black Holes (Solid Ground)"" [Official Lyric Video]",1,0,0,,Bitupan Boruah,https://yt3.ggpht.com/a/AATXAJynqRJSZ6mFindoJc9aoKzDuxTOUou6E8BbXQ=s48-c-k-c0xffffffff-no-rj-mo
5053,,3336,i saw them yesterday in vienna and damn they‘re so so good wow🤩 and btw the drummer is so hot haha,false,1541882468000,"The Blue Stones ""Black Holes (Solid Ground)"" [Official Lyric Video]",1,0,0,,Julia Maurer,https://yt3.ggpht.com/a/AATXAJztd3BV6RE5S5PhW2HxoNt70aJKhmAgzt0Qxg=s48-c-k-c0xffffffff-no-rj-mo
4714,,2768,That guitar just kills me everytime. Such a beautiful song!,false,1534725931000,"The Blue Stones ""Be My Fire"" [Audio]",2,0,0,1534725931000,Loree Lamia,https://yt3.ggpht.com/a/AATXAJwAt_R57n9vaWMQ6_kTIisQEbzdfrEPrO6MgFeG3w=s48-c-k-c0xffffffff-no-rj-mo
3891,,2314,I can see these guys becoming real famous real soon...and im all for it,false,1574232883000,The Blue Stones - Shakin' Off the Rust [Official Music Video],1,0,0,,George Vlassis,https://yt3.ggpht.com/a/AATXAJx0Wtk8RFKN3j2Bf_-VgqPK9sF_2nrpsBXD0rtmzQ=s48-c-k-c0xffffffff-no-rj-mo
3960,,2373,CHECK 🔥https://youtu.be/lNfSFdGMzxA,false,1574206177000,The Blue Stones - Shakin' Off the Rust [Official Music Video],3,2,0,1574206186000,Official Andre zeronine,https://yt3.ggpht.com/a/AATXAJzfhJ6_hXx4xk_VO_OBMJatvNaP8BrmGw8Q6Fwo=s48-c-k-c0xffffffff-no-rj-mo
934004,4152,603499,Congrats have fun at college live life to the fullest 🙃,false,1597237363000,The Blue Stones - Shakin' Off The Rust [Official Lyric Video],,,,,Nihaal Kang,https://yt3.ggpht.com/ytc/AAUvwnhTp-tJ1VIYY-_WAFZlNlsJPVZ6gDCmcAc3XHqj=s48-c-k-c0xffffffff-no-rj-mo
356950,,253465,THE BLUE STONES ......HELL TO THE YES!,false,1603506059000,The Blue Stones - Grim (Live on Display),1,0,0,,Dale Sharpy,https://yt3.ggpht.com/a/AATXAJwNFiN3GSPooSSvi9AvVR-ctGTsmLzGxC8wXQ=s48-c-k-c0xffffffff-no-rj-mo
4694,,3020,Are they revamping all their songs? I am really excited to see what The Drop will sound like.,false,1535508412000,"The Blue Stones ""Be My Fire"" [Audio]",1,0,0,,BigFreshSauce,https://yt3.ggpht.com/a/AATXAJxt7hoLZ4Qi95KJkNiMZX-F7QOYiJPrxHIRLT5QvQ=s48-c-k-c0xffffffff-no-rj-mo
4920,,3215,:o,false,1560056520000,"The Blue Stones ""Black Holes (Solid Ground)"" [Official Lyric Video]",1,0,0,,Sean Fotherby,https://yt3.ggpht.com/a/AATXAJyhcuGxcb4vPErTk-Epr5Y7KTNuXkyWIWAI6vYI=s48-c-k-c0xffffffff-no-rj-mo
6712,,4125,This slaps so hard! Amazing stuff,false,1599777212000,The Blue Stones - Let It Ride (Official Video - Live on Display),1,0,0,,Vicious Summer,https://yt3.ggpht.com/a/AATXAJy3-IxqyhUnoWM_vPAyAO4W9k--zaptVGHz02W-=s48-c-k-c0xffffffff-no-rj-mo
3745,,2180,my body is ready,false,1592017120000,The Blue Stones - Shakin' Off the Rust [Official Music Video],3,0,0,1590796221000,Michael Scafe,https://yt3.ggpht.com/a/AATXAJyLixeYKUCAgXW9ekBDQp9S5rRbhtm2zjbpkekBbA=s48-c-k-c0xffffffff-no-rj-mo
3479,,1945,💖💖💖,false,1588547016000,Late night piano jam,1,0,0,,Love Love,https://yt3.ggpht.com/a/AATXAJxwN6yURzjJb_LW6CHsNJc_nr1T_L2kayg_JjAa_g=s48-c-k-c0xffffffff-no-rj-mo
3431,,1912,Des Moines IA....attending a live concert soon.,false,1598480132000,Grim and Careless (Piano Version),1,0,0,,Ed Moss,https://yt3.ggpht.com/a/AATXAJwwY3S368v5doybusR46HL3Z7meePjvhnhqnQ=s48-c-k-c0xffffffff-no-rj-mo
4448,,2808,They are fire ❤,false,1570781304000,The Blue Stones - Shakin' Off The Rust [Official Lyric Video],2,1,0,1569034335000,Jesus Violante,https://yt3.ggpht.com/a/AATXAJyANFQLlLrDXlBMU5uM_u_hc58miE5lPO-yoQktLw=s48-c-k-c0xffffffff-no-rj-mo
934190,4783,1946,You need more music. I saw less than ten.,false,1587025245000,"The Blue Stones ""Black Holes (Solid Ground)"" [Official Lyric Video]",3,1,0,1587025245000,wannabecarguy,https://yt3.ggpht.com/a/AATXAJxkhDPQFI7If0WIBPP6m69dO08ikLn0lIZjv892=s48-c-k-c0xffffffff-no-rj-mo
3693,,2137,"You've to play in Argentina, in a future.",false,1576278126000,The Blue Stones - Grim (European Field Trip 2019),1,0,0,,Ezequiel Luna,https://yt3.ggpht.com/a/AATXAJysujqpcl4lBTl7ro9ywh59hdUFyEvokh0msM7NuXo=s48-c-k-c0xffffffff-no-rj-mo
4894,,3193,"I love this song! Keep it up like this,guys!",false,1563834505000,"The Blue Stones ""Black Holes (Solid Ground)"" [Official Lyric Video]",1,0,0,,Shadow Face,https://yt3.ggpht.com/a/AATXAJxQHxpqK0hPeZBYEa8nS0jMiYGEYRff8ZA_0g=s48-c-k-c0xffffffff-no-rj-mo
933989,4054,603489,relatable lol :P,false,1590925287000,The Blue Stones - Shakin' Off The Rust [Official Lyric Video],,,,,Junior ʕ•ᴥ•ʔ,https://yt3.ggpht.com/ytc/AAUvwnjXlL2KiXhJoBQ2wTMVSEvYfRIoFR_E8Gd_Y0pdfQ=s48-c-k-c0xffffffff-no-rj-mo
109402,,87673,good music broth,false,1601183302000,The Blue Stones - Let It Ride (Official Video - Live on Display),1,0,0,,mario david,https://yt3.ggpht.com/a/AATXAJzlgs9B2GDIHxnucojDDI7DZ2desuQfYRXe9YZoiw=s48-c-k-c0xffffffff-no-rj-mo
3419,,1900,Amazing...Careless gives me goosebumps!,true,1599363044000,Grim and Careless (Piano Version),2,0,0,1599363044000,Claudia de Oliveira,https://yt3.ggpht.com/a/AATXAJzNG6xFm5wbiqttPtDH7STtG1UjZ8plHa4CS4KepLU=s48-c-k-c0xffffffff-no-rj-mo
3686,,2130,"i love it!
Me gusta su música, sigan así!",false,1576289154000,The Blue Stones - Grim (European Field Trip 2019),3,0,0,1574211261000,Franco Garcia,https://yt3.ggpht.com/a/AATXAJxNqbba_2djSxgkMrM7DU4YhugSliKKh3GJMMgsjw=s48-c-k-c0xffffffff-no-rj-mo
4326,,2712,Thank you YouTube recommendation!,false,1571153944000,The Blue Stones - Shakin' Off The Rust [Official Lyric Video],1,0,0,,LaDolceVita,https://yt3.ggpht.com/a/AATXAJzCsey-hkLuq5fSufr1YUgAw06_4vfGtEGCCECC=s48-c-k-c0xffffffff-no-rj-mo
6755,6737,,"Love ya too, Jess",false,1599776934000,The Blue Stones - Let It Ride (Official Video - Live on Display),,,,,,
6714,,4126,"You guys never disappoint! 🔥🔥🔥 Awesome new song, now I can't wait until I can download it from Apple Music.",false,1599776842000,The Blue Stones - Let It Ride (Official Video - Live on Display),2,1,0,1599776842000,Carla Phipps,https://yt3.ggpht.com/a/AATXAJxd90DihGw3RtSi1pmd4ETb-OSM22cYSsKlWg=s48-c-k-c0xffffffff-no-rj-mo
4764,,3081,HOLY FRIJOLE!! HOW DID I MISS THIS GROUP???,false,1589925728000,"The Blue Stones ""Black Holes (Solid Ground)"" [Official Lyric Video]",1,0,0,,Tom Perkins,https://yt3.ggpht.com/a/AATXAJyBM5dU4_0SZE4yCVMP-m2ByXiLTmrqBh5OymJ6=s48-c-k-c0xffffffff-no-rj-mo
12773,,3062,"Let it ride, cause it's off the chart 🤘🕶️🤘",true,1599953133000,The Blue Stones - Let It Ride (Official Video - Live on Display),9,3,1,1603603018000,johnnie soesbee,https://yt3.ggpht.com/a/AATXAJyfMFkX0K3gnnofx9SDk4mEGwXkjDG5_5UaDlGQ=s48-c-k-c0xffffffff-no-rj-mo
216188,,173341,"Saw them in Rochester and they hyped us up so much, can’t wait to see them again and be hyped all over again.",false,1602820524000,The Blue Stones - Live on Display,1,0,0,,thesilverfish5,https://yt3.ggpht.com/a/AATXAJwmQFT-Y7YwEEwk9C29hoaNjzVinhFKL7yc32LO=s48-c-k-c0xffffffff-no-rj-mo
933862,3594,,thanks guys,false,1595541769000,Careless [Visualizer Lyric Video],,,,,,
215858,,173255,🇲🇽🔥🇲🇽,false,1602203650000,The Blue Stones - Shakin' Off The Rust [Official Lyric Video],4,0,0,1602823110000,FoxWolf666,https://yt3.ggpht.com/a/AATXAJziDIpCgP_8luG9kPW4z-r_sPuVH3w1ZXmKQDuliQ=s48-c-k-c0xffffffff-no-rj-mo
4456,,2027,I’m digging the beat and how calm but smooth the song sounds,false,1570780930000,The Blue Stones - Shakin' Off The Rust [Official Lyric Video],3,0,1,1586343059000,Anonymous,https://yt3.ggpht.com/a/AATXAJxeVPdd3HUCE8hSn3_zfU3_i6u58TxZWJdkqniv=s48-c-k-c0xffffffff-no-rj-mo
356341,,253168,"I love this song; the lyrics resonate so deeply, and the music itself gives me chills. When I found this song, I had been utterly out of sync with myself for a long time but was starting to work on that... literally just beginning to get myself back together after [unintentionally] letting myself sink into a depression for nearly three years.
Then the pandemic hits... 
but I had this song, and a few others, that helped me keep my head up. There are many tools a person can utilize to dig themselves up out of whatever dark hole they’re in. This song is one of mine.
Thank you for putting this powerful song into the world; I’d bet I’m not the only one who needed it.",false,1603318346000,The Blue Stones - Shakin' Off The Rust (Live on Display),2,1,0,1603318346000,Francine Smith,https://yt3.ggpht.com/a/AATXAJzYw5wAIgs1e2_HBGHAKpzeKJvypN1LdYA0qQ=s48-c-k-c0xffffffff-no-rj-mo
4724,,3046,Nice!,false,1534517151000,"The Blue Stones ""Be My Fire"" [Audio]",1,0,0,,Somborn,https://yt3.ggpht.com/a/AATXAJznW2nNvE4aw9LUMNA68kqmyBthtIgsQbY-VY1k=s48-c-k-c0xffffffff-no-rj-mo
356342,,2106,Goosebumps! 🔥,false,1603316026000,The Blue Stones - Shakin' Off The Rust (Live on Display),13,6,0,1603316026000,Corbettreportfan- Dmtwillsetyoufree,https://yt3.ggpht.com/a/AATXAJy9Vpew11jAoY_EmBKgGail17mCtW72F5gqv0J1=s48-c-k-c0xffffffff-no-rj-mo
3521,,1978,Howdy from Georgia!,false,1587775309000,Be My Fire - Guitar Lesson + Performance,1,0,0,,Cindy Henderson,https://yt3.ggpht.com/a/AATXAJzNXCb-hwqhd7Xddr0xoqsLwp-396gPt-8_KQ=s48-c-k-c0xffffffff-no-rj-mo
4862,,3166,Yes,false,1568014365000,"The Blue Stones ""Black Holes (Solid Ground)"" [Official Lyric Video]",1,0,0,,Isaac Rodriguez,https://yt3.ggpht.com/a/AATXAJzKhK2kZKi9lRn-gT0qTp-PUtxi3Qn7XxD-Sg=s48-c-k-c0xffffffff-no-rj-mo
3814,,2244,"Ya, these guys are great.",false,1580503550000,The Blue Stones - Shakin' Off the Rust [Official Music Video],1,0,0,,L C,https://yt3.ggpht.com/a/AATXAJyZNzKvClEnHXxpZlh7mqcVRB5LDv7Y652oRlHxqQ=s48-c-k-c0xffffffff-no-rj-mo
3834,,1893,"The most creative music video I've ever seen =)))
Can't wait for more to come",false,1575038439000,The Blue Stones - Shakin' Off the Rust [Official Music Video],3,0,0,1585919491000,Alireza Barani,https://yt3.ggpht.com/a/AATXAJwVM2yCgOBw7soXWmVx1isO6kb3AsPKvyeMPwBEvw=s48-c-k-c0xffffffff-no-rj-mo
4244,,2636,At about 0:44 its sounds like Radiohead for a couple of seconds,false,1571557161000,The Blue Stones - Shakin' Off The Rust [Official Lyric Video],1,0,0,,Alien Noodle,https://yt3.ggpht.com/a/AATXAJxx67QbbAYeUF29vwswZN4SDJOQuVJrS5ZpHi0mmA=s48-c-k-c0xffffffff-no-rj-mo
4932,,3226,"Awesome live show, Vic, BC.
Go see them live if ya dig",false,1556436052000,"The Blue Stones ""Black Holes (Solid Ground)"" [Official Lyric Video]",1,0,0,,music15myHEARTBEAT,https://yt3.ggpht.com/a/AATXAJyPL-oHBwT-BeNI1yygK2T8eDFPplkJU118mIx-=s48-c-k-c0xffffffff-no-rj-mo
933927,3829,2245,Hi from Texas!!!,false,1580468503000,The Blue Stones - Shakin' Off the Rust [Official Music Video],4,3,0,1580470592000,Lara Bauer,https://yt3.ggpht.com/a/AATXAJwlbEP6ulOqpNoQdIaoMKXNxAVZkpiHo0S_t4E9mZQ=s48-c-k-c0xffffffff-no-rj-mo
3904,,2327,can yall subscribe to my channel I just started I'm trying to grow my channel,false,1574219842000,The Blue Stones - Shakin' Off the Rust [Official Music Video],1,0,0,,Lilmercipop BMD,https://yt3.ggpht.com/a/AATXAJwH53pX8Y4pFB3dEMw1zze3XK9jLPInWPZTjbJ01w=s48-c-k-c0xffffffff-no-rj-mo
4280,,2667,You did awesome job making this song I enjoy listening to it and I love it:),false,1571369886000,The Blue Stones - Shakin' Off The Rust [Official Lyric Video],1,0,0,,Scarlet Angel,https://yt3.ggpht.com/a/AATXAJzCcn-EjdB1P9w8hQS4M9zK3NjFB4nuqYVW_w=s48-c-k-c0xffffffff-no-rj-mo
4108,,2510,Your song is in my head now. Awesome!,false,1583464684000,The Blue Stones - Shakin' Off The Rust [Official Lyric Video],2,0,0,1583464684000,cuesgirl,https://yt3.ggpht.com/a/AATXAJwxqyaaaRq8fnWHVEw_K-KUtpfeEmR-ecYzIaXk=s48-c-k-c0xffffffff-no-rj-mo
3969,,2381,Muito top,false,1574205533000,The Blue Stones - Shakin' Off the Rust [Official Music Video],1,0,0,,Victor Manoel,https://yt3.ggpht.com/a/AATXAJwP8T0Nhui2ryt0slfY5AKheEzDYI1V7d61zXzIaw=s48-c-k-c0xffffffff-no-rj-mo
933890,3705,603443,"Sorry, they played it at Newcastle before Leeds. Awesome you were on vid tho'",false,1576362495000,The Blue Stones - Grim (European Field Trip 2019),,,,,helenlegs11,https://yt3.ggpht.com/ytc/AAUvwngp8ujuJIqLP97lfLee5kfI23S9fdT46Znk4w=s48-c-k-c0xffffffff-no-rj-mo
216196,,173348,You guys are the best!!! I hope to see you in concert soon i love every song!!!!,false,1602813834000,The Blue Stones - Live on Display,1,0,0,,David Riedy,https://yt3.ggpht.com/a/AATXAJxXsXrq0z4augFzcljvrrl-3zfmhXbVfM-x_69R=s48-c-k-c0xffffffff-no-rj-mo
3875,,2300,Venezuela presente y al frente,false,1574270024000,The Blue Stones - Shakin' Off the Rust [Official Music Video],1,0,0,,Manuel Villegas,https://yt3.ggpht.com/a/AATXAJzAfKlelbOkrTBW1AID3c96VIHb-Mfq-SPp=s48-c-k-c0xffffffff-no-rj-mo
934062,4341,603533,This isn't Blue Stones it's Greta Van Fleet,false,1571491173000,The Blue Stones - Shakin' Off The Rust [Official Lyric Video],,,,,Connor Stiles,https://yt3.ggpht.com/ytc/AAUvwnjZgxpVEgW6FTnBGppOhgK-8ry0YWyKcIOqlZynvw=s48-c-k-c0xffffffff-no-rj-mo
4880,,3182,"The ending sounds different from the first version they uploaded
But the song is still amazing",false,1565555371000,"The Blue Stones ""Black Holes (Solid Ground)"" [Official Lyric Video]",1,0,0,,Banquo Disciole,https://yt3.ggpht.com/a/AATXAJxg2BtISV8Umdf6WA4jVl7nhTmMhAKPktQuqhSvzjU=s48-c-k-c0xffffffff-no-rj-mo
933827,,603429,TF is this. Need that harder stuff bud,false,1607139119000,Careless [Visualizer Lyric Video],1,0,0,,Vince Heywood,https://yt3.ggpht.com/ytc/AAUvwngN4TmU0MfEojZbcLesFooEuLmViSXMdiXFdg=s48-c-k-c0xffffffff-no-rj-mo
933939,3891,2230,They're already touring Canada!! I found them a year (give or take) ago on youtube and the last thing I expected was a show local to my town lol but lo and behold it's happening. They even get played on the radio here and there.,false,1582930593000,The Blue Stones - Shakin' Off the Rust [Official Music Video],3,2,0,1582930593000,Mary Pedersen,https://yt3.ggpht.com/a/AATXAJz0FtdmsU6JP19U9Dqog2yWkRiYMs5MaZVdPg=s48-c-k-c0xffffffff-no-rj-mo
4420,,2785,"Zero deaths, ah... I mean... dislikes. Yeah zero dislikes very cool",false,1570802647000,The Blue Stones - Shakin' Off The Rust [Official Lyric Video],1,0,0,,Unit 47,https://yt3.ggpht.com/a/AATXAJxKbbAxDanylGYqgI4wDxBkpRfIkX4B-Y-Kf2WP=s48-c-k-c0xffffffff-no-rj-mo
3902,,2325,Desde México!!!!!,false,1574221542000,The Blue Stones - Shakin' Off the Rust [Official Music Video],1,0,0,,Lion Ghost Music,https://yt3.ggpht.com/a/AATXAJysnrYoe4frhutBXUdQEA2jtySyM3YACbgwfg=s48-c-k-c0xffffffff-no-rj-mo
4631,,2963,Anyone get The Cult vibe? Maybe?,false,1541084765000,"The Blue Stones ""Be My Fire"" [Audio]",2,0,0,1541084765000,Pumpkineck Bort,https://yt3.ggpht.com/a/AATXAJzWAQ91kvq36TESiUNK_1sk_NjBnXMxx_aEUiIY7w=s48-c-k-c0xffffffff-no-rj-mo
4336,,2722,"the whole lyrics

Bang my head against the wall
Try to find my stride but I trip and I fall
Losing my attention again
Yeah, I hit the bottom but I'm on the mend

I get up
Take another step, push it to the edge
I get up
Just a little more, I can see the end
I get up
Yeah, you're finished, yeah, you're mine, always win in due time

You think too much, it's in my head
So, I'm shaking off the rust and
You got no trust, it's in my head
So, I'm shaking off the rust
I think I broke just a little bit
Walked through the fire, made it back again
Lord knows I tried everything I can
Now, I'm shaking off the rust
(I'm shaking off the rust)

Bang my head against the wall
Try to hold a smile but I'm sick of it all
Everyone with something to say
Better hold my tongue or I'll make my mistake

I get up
Show 'em what I do, show 'em how it's done
I get up
Never turn it down, never gonna run, I learn

You think too much, it's in my head
So, I'm shaking off the rust and
You got no trust, it's in my head
So, I'm shaking off the rust
I think I broke just a little bit
Walked through the fire, made it back again
Lord knows I tried everything I can
Now, I'm shaking off the rust
(I'm shaking off the rust)

(I'm, oh)
(I'm shaking off the rust)

You think too much, it's in my head
So, I'm shaking off the rust and
You got no trust, it's in my head
Now, I'm shaking off the rust
I think I broke just a little bit
Walked through the fire, made it back again
Lord knows I tried everything I can
And I'm shaking off the rust
Yeah, I'm shaking off the rust",false,1571080894000,The Blue Stones - Shakin' Off The Rust [Official Lyric Video],1,0,0,,Molnár Mónika,https://yt3.ggpht.com/a/AATXAJzFW1-MxKFL_BR44eMps4Luw_HdNLKNnac2s70K=s48-c-k-c0xffffffff-no-rj-mo
4931,,3225,When the recommendations of YouTube finally get it right,false,1556489459000,"The Blue Stones ""Black Holes (Solid Ground)"" [Official Lyric Video]",1,0,0,,Mariana Lourenço,https://yt3.ggpht.com/a/AATXAJxR8RtBksrpw2gB7P1tDi0EJvT3F1mFTsfrgEsGYQ=s48-c-k-c0xffffffff-no-rj-mo
